{
  "version": "1",
  "project_id": "ax1-komatsu-testimonial-d4892",
  "timeline_version": "1",
  "summary": {
    "total_checks": 10,
    "by_status": {
      "pass": 7,
      "warn": 1,
      "fail": 0,
      "skipped": 2
    },
    "by_tier": {
      "emotion": {
        "pass": 2,
        "warn": 0,
        "fail": 0,
        "skipped": 0
      },
      "story": {
        "pass": 1,
        "warn": 0,
        "fail": 0,
        "skipped": 1
      },
      "rhythm": {
        "pass": 3,
        "warn": 0,
        "fail": 0,
        "skipped": 0
      },
      "eye_trace": {
        "pass": 0,
        "warn": 1,
        "fail": 0,
        "skipped": 0
      },
      "plane_2d": {
        "pass": 0,
        "warn": 0,
        "fail": 0,
        "skipped": 1
      },
      "audio": {
        "pass": 1,
        "warn": 0,
        "fail": 0,
        "skipped": 0
      }
    }
  },
  "checks": [
    {
      "id": "rhythm.beat_duration_deviation",
      "tier": "rhythm",
      "status": "pass",
      "measured": {
        "max_deviation_pct": 1.411,
        "beats": [
          {
            "beat_id": "komatsu_hook",
            "target_frames": 833,
            "actual_frames": 823,
            "deviation_pct": 1.2
          },
          {
            "beat_id": "komatsu_closing",
            "target_frames": 1063,
            "actual_frames": 1048,
            "deviation_pct": 1.411
          }
        ]
      },
      "threshold": {
        "warn_pct": 10,
        "fail_pct": 20
      },
      "evidence": [
        "All 2 beat windows are within 10% pacing tolerance."
      ]
    },
    {
      "id": "rhythm.max_shot_length",
      "tier": "rhythm",
      "status": "pass",
      "measured": {
        "max_shot_length_frames": 1048,
        "clips_over_threshold": []
      },
      "threshold": {
        "max_shot_length_frames": 1063
      },
      "evidence": [
        "No video clip exceeds max_shot_length_frames=1063."
      ]
    },
    {
      "id": "rhythm.cadence_distribution",
      "tier": "rhythm",
      "status": "pass",
      "measured": {
        "average_shot_length_frames": {
          "opening": 823,
          "middle": null,
          "ending": 1048
        },
        "section_clip_counts": {
          "opening": 1,
          "middle": 0,
          "ending": 1
        },
        "cadence_rank": {
          "opening": 1,
          "middle": 3,
          "ending": 3
        }
      },
      "threshold": {
        "opening_cadence": "小松社長の「そこが良かった」からすぐに本題へ入り、質問音声を置かない。",
        "middle_cadence": "長い一文を意味単位の字幕で支え、発話の呼吸は不自然に詰めない。",
        "ending_cadence": "「まずトップが感じることが大事」を言い切った後、短い表情の余韻を残す。",
        "comparison_tolerance_pct": 5
      },
      "evidence": [
        "Average V1 shot length order is consistent with cadence policy across opening -> ending."
      ]
    },
    {
      "id": "story.required_roles",
      "tier": "story",
      "status": "pass",
      "measured": {
        "missing_required_roles": []
      },
      "threshold": {
        "required_roles_source": "edit_blueprint.beats[].required_roles"
      },
      "evidence": [
        "Every blueprint beat has its required roles represented on the timeline."
      ]
    },
    {
      "id": "story.chronology",
      "tier": "story",
      "status": "skipped",
      "measured": null,
      "threshold": null,
      "evidence": [
        "brief.order_policy is not chronological."
      ]
    },
    {
      "id": "emotion.peak_retention",
      "tier": "emotion",
      "status": "pass",
      "measured": {
        "evaluated_strong_peaks": 0,
        "discarded_strong_peaks": [],
        "ignored_strong_peaks_outside_candidate_ranges": 2
      },
      "threshold": {
        "strong_peak_confidence_min": 0.75
      },
      "evidence": [
        "Selected timeline candidate ranges contain no strong peak moments to protect."
      ]
    },
    {
      "id": "emotion.hook_density",
      "tier": "emotion",
      "status": "pass",
      "measured": {
        "hook_density": 1,
        "hook_window_frames": {
          "start": 0,
          "end": 823
        },
        "hook_clip_count": 1,
        "high_signal_clip_ids": [
          "CLP_0001"
        ]
      },
      "threshold": {
        "hook_density_min": 0.3
      },
      "evidence": [
        "Hook density 1 meets target 0.3 using retained peak or editorial signals."
      ]
    },
    {
      "id": "eye_trace.same_asset_adjacency",
      "tier": "eye_trace",
      "status": "warn",
      "measured": {
        "adjacent_pairs": 1,
        "same_asset_pairs": [
          {
            "left_clip_id": "CLP_0001",
            "right_clip_id": "CLP_0002",
            "asset_id": "AST_610FB4A0"
          }
        ],
        "v1_asset_ids": [
          "AST_610FB4A0"
        ],
        "selected_candidate_asset_ids": [
          "AST_610FB4A0"
        ]
      },
      "threshold": {
        "max_same_asset_adjacent_pairs": 0,
        "scope": "V1"
      },
      "evidence": [
        "Selected candidates expose only 1 unique asset (AST_610FB4A0); same-asset adjacency is unavoidable and remains a review warning until broader visual candidates exist.",
        "CLP_0001->CLP_0002: adjacent V1 clips reuse AST_610FB4A0"
      ]
    },
    {
      "id": "plane_2d.motif_overuse",
      "tier": "plane_2d",
      "status": "skipped",
      "measured": null,
      "threshold": null,
      "evidence": [
        "No selected video candidates expose motif_tags."
      ]
    },
    {
      "id": "audio.speech_cut",
      "tier": "audio",
      "status": "pass",
      "measured": {
        "checked_clip_count": 2,
        "speech_cut_violations": []
      },
      "threshold": {
        "speech_cut_guard_us": 80000
      },
      "evidence": [
        "No clip boundary cuts through transcript utterances (checked 2 clips)."
      ]
    }
  ]
}
